[
  {
    "phase": "prefill",
    "batch": 1,
    "new_tokens": 512,
    "past_tokens": 0,
    "total_visible_length": 512,
    "output_length": 128,
    "activation_dtype": "bfloat16",
    "weight_format": "bfloat16",
    "kv_dtype": "bfloat16",
    "backend": "formula-only",
    "hardware": "unknown"
  },
  {
    "phase": "decode",
    "batch": 1,
    "new_tokens": 1,
    "past_tokens": 4096,
    "total_visible_length": 4097,
    "output_length": 1,
    "activation_dtype": "bfloat16",
    "weight_format": "int4",
    "kv_dtype": "bfloat16",
    "backend": "formula-only",
    "hardware": "unknown"
  }
]
